{
  "app": {
    "id": "regentspace-builder",
    "name": "RegentPay",
    "description": "A modern VTU and bill payment application",
    "packageName": "com.regent.regentpay",
    "version": "1.0.0",
    "versionCode": 1,
    "fcmChannel": "regentpay_channel",
    "iconBase64": "optional base64-encoded PNG/JPEG app icon from canva"
  },
  "firebase": {
    "projectId": "regentspace-builder",
    "projectNumber": "540697819834",
    "storageBucket": "regentspace-builder.firebasestorage.app",
    "appId": "1:540697819834:android:fea3c4853d6afb31c82083",
    "apiKey": "AIzaSyDKvRGEE-9HcPtrJqrAlR0ZD4020BKa9NQ"
  },
  "theme": {
    "primaryColor": "#6C0090",
    "accentColor": "#740690",
    "background": "#F5F5F7"
  },
  "screens": [
    {
      "type": "intro",
      "bg": "#F7F7F7",
      "elements": {
        "intro_title": {
          "text": "RegentPay",
          "color": "#444444"
        },
        "intro_description": {
          "text": "Fast, secure VTU and bill payments",
          "color": "#AAAAAA"
        }
      }
    },
    {
      "type": "login",
      "bg": "#F7F7F7",
      "elements": {
        "login_heading": {
          "text": "Welcome Back",
          "color": "#333333"
        },
        "login_subtitle": {
          "text": "Sign in to continue",
          "color": "#AAAAAA"
        },
        "login_email": { "bg": "#FFFFFF", "color": "#333333" },
        "login_email_label": { "text": "Email Address", "color": "#666666" },
        "login_email_hint": { "text": "you@regentpay.com", "color": "#AAAAAA" },
        "login_email_border": { "color": "#E0E0E0" },
        "login_password": { "bg": "#FFFFFF", "color": "#333333" },
        "login_password_label": { "text": "Password", "color": "#666666" },
        "login_password_hint": { "text": "••••••••", "color": "#AAAAAA" },
        "login_password_border": { "color": "#E0E0E0" },
        "login_forgot": { "text": "Forgot password?", "color": "#B0B0B0" },
        "login_button": {
          "text": "Sign In",
          "color": "#FFFFFF",
          "bg": "#6C0090"
        },
        "login_signup": {
          "text": "Don't have an account? Sign up",
          "color": "#AAAAAA"
        }
      }
    },
    {
      "type": "signup",
      "bg": "#F7F7F7",
      "elements": {
        "signup_heading": {
          "text": "Create Account",
          "color": "#333333"
        },
        "signup_subtitle": {
          "text": "Join RegentPay today",
          "color": "#AAAAAA"
        },
        "signup_username": { "bg": "#FFFFFF" },
        "signup_username_label": { "text": "Username", "color": "#888888" },
        "signup_username_hint": { "text": "e.g. John", "color": "#C0C0C0" },
        "signup_username_border": { "color": "#E0E0E0" },
        "signup_email": { "bg": "#FFFFFF" },
        "signup_email_label": { "text": "Email Address", "color": "#888888" },
        "signup_email_hint": { "text": "you@regentpay.com", "color": "#C0C0C0" },
        "signup_email_border": { "color": "#E0E0E0" },
        "signup_password": { "bg": "#FFFFFF" },
        "signup_password_label": { "text": "Password", "color": "#888888" },
        "signup_password_hint": { "text": "••••••••", "color": "#C0C0C0" },
        "signup_password_border": { "color": "#E0E0E0" },
        "signup_confirm": { "bg": "#FFFFFF" },
        "signup_confirm_label": { "text": "Confirm Password", "color": "#888888" },
        "signup_confirm_hint": { "text": "••••••••", "color": "#C0C0C0" },
        "signup_confirm_border": { "color": "#E0E0E0" },
        "signup_button": {
          "text": "Create Account",
          "color": "#FFFFFF",
          "bg": "#6C0090"
        },
        "signup_login": {
          "text": "Already have an account? Sign in",
          "color": "#AAAAAA"
        }
      }
    },
    {
      "type": "home",
      "bg": "#F7F7F7",
      "elements": {
        "home_wallet": {
          "bg": "#595858",
          "color": "#AAAAAA"
        },
        "home_wallet_amount": {
          "text": "\u20A60.00",
          "color": "#FFFFFF"
        },
        "home_wallet_label": { "color": "#AAAAAA" },
        "home_wallet_button": { "bg": "#6C0090" },
        "home_wallet_button_text": { "color": "#FFFFFF" },
        "home_services_title": {
          "text": "Services",
          "color": "#444444"
        },
        "service_airtime_icon": { "color": "#6C0090" },
        "service_airtime_text": { "color": "#444444" },
        "service_data_icon": { "color": "#6C0090" },
        "service_data_text": { "color": "#444444" },
        "service_electricity_icon": { "color": "#6C0090" },
        "service_electricity_text": { "color": "#444444" },
        "service_cable_icon": { "color": "#6C0090" },
        "service_cable_text": { "color": "#444444" }
      }
    },
    {
      "type": "finance",
      "bg": "#F7F7F7",
      "elements": {
        "finance_heading": {
          "text": "Finance",
          "color": "#333333"
        },
        "finance_subtitle": {
          "text": "Track your balance and spending",
          "color": "#AAAAAA"
        },
        "finance_summary": { "color": "#6C0090" },
        "finance_plan_title": {
          "text": "Current Plan",
          "color": "#444444"
        },
        "finance_plan_card": {
          "bg": "#595858",
          "color": "#FFFFFF"
        },
        "finance_plan_card_title": { "color": "#FFFFFF" },
        "finance_plan_card_subtitle": { "color": "#AAAAAA" },
        "finance_plan_card_renew": { "color": "#AAAAAA" },
        "finance_plan_card_button": { "bg": "#6C0090" },
        "finance_plan_card_button_text": { "color": "#FFFFFF" },
        "finance_transactions_title": {
          "text": "Recent Transactions",
          "color": "#444444"
        },
        "finance_transactions_list": { "bg": "#FFFFFF" },
        "finance_transactions_list_icon": { "color": "#6C0090" },
        "finance_transactions_list_text": { "color": "#444444" }
      }
    },
    {
      "type": "profile",
      "bg": "#F7F7F7",
      "elements": {
        "profile_heading": {
          "text": "Profile",
          "color": "#333333"
        },
        "profile_personal": { "bg": "#FFFFFF", "color": "#444444" },
        "profile_payment": { "bg": "#FFFFFF", "color": "#444444" },
        "profile_security": { "bg": "#FFFFFF", "color": "#444444" },
        "profile_notifications": { "bg": "#FFFFFF", "color": "#444444" },
        "profile_help": { "bg": "#FFFFFF", "color": "#444444" },
        "profile_logout": { "bg": "#FFFFFF", "color": "#E53935" }
      }
    }
  ],
  "navigation": {
    "type": "bottom_nav",
    "tabs": ["home", "finance", "profile"]
  }
}
